{
  "version": "1.2.0",
  "restrictionMarkers": {
    "es": ["solo", "exclusivamente"],
    "en": ["only", "exclusively"]
  },
  "disenosQueMezclan": ["guia", "revision_sistematica"],
  "criteria": {
    "estado_menopausico": {
      "synonyms": {
        "premenopausica": [
          "premenopausal women",
          "premenopáusica",
          "premenopausal patients in the STO-5 trial",
          "premenopausica"
        ],
        "perimenopausica": ["perimenopausal women", "perimenopáusica", "perimenopausica"],
        "postmenopausica": [
          "postmenopausal women",
          "posmenopáusica",
          "postmenopausal patients in the STO-2 and STO-3 trials",
          "posmenopausica"
        ]
      }
    },
    "estado_her2": {
      "synonyms": {
        "positivo": ["HER2-positive (IHC 3+)", "HER2-positive metastatic breast cancer"],
        "negativo": [
          "HER2-negative (IHC 2+, ISH not amplified)",
          "estrogen receptor–positive and HER2-negative breast cancer patients with luminal A or B subtype",
          "estrogen receptor–positive and HER2-negative tumors"
        ]
      }
    },
    "receptores_hormonales": {
      "synonyms": {
        "triple_negativo": ["triple-negative (TNBC)"]
      }
    }
  }
}
